{"bundle_hash":"d5b8a3ee998035ae3999b8b5051defa3618e3921daf1809653e4dbdc6306ff27","bundle_schema_version":"joewrks.runtime-evidence-bundle/1.0","records":[{"adapter":{"name":"m6-dogfood-local-fixture","version":"1.0.0"},"after":{"authoritative_state":{"active_review_link_id":null,"pins":[{"media_type":"IMAGE","pin_id":"pin-001","root_comment":"Fixture root comment.","thread_id":"thread-001","version_id":"version-fixture-001","x":0.25,"y":0.75}],"project_id":"project-fixture-001","review_link_revision":0,"review_links":[],"threads":[{"pin_id":"pin-001","replies":[],"root_comment":"Fixture root comment.","status":"OPEN","thread_id":"thread-001"}],"version":{"revision":2,"status":"DRAFT","version_id":"version-fixture-001"}},"business_side_effects":[{"action_id":"create_pin","effect":"PIN_CREATED","pin_id":"pin-001","sequence":1,"thread_id":"thread-001"}],"delivery_effects":[],"history":[{"action_id":"create_pin","actor":"Client Reviewer","event":"PIN_CREATED","pin_id":"pin-001","sequence":1,"thread_id":"thread-001"}],"revision":2},"authority":{"approved_digest":"e33deda04bae78eab0da60ba432c47a0779bce17c4bee7d1c5695455d9d9f68c","approved_revision":1},"before":{"authoritative_state":{"active_review_link_id":null,"pins":[{"media_type":"IMAGE","pin_id":"pin-001","root_comment":"Fixture root comment.","thread_id":"thread-001","version_id":"version-fixture-001","x":0.25,"y":0.75}],"project_id":"project-fixture-001","review_link_revision":0,"review_links":[],"threads":[{"pin_id":"pin-001","replies":[],"root_comment":"Fixture root comment.","status":"OPEN","thread_id":"thread-001"}],"version":{"revision":2,"status":"DRAFT","version_id":"version-fixture-001"}},"business_side_effects":[{"action_id":"create_pin","effect":"PIN_CREATED","pin_id":"pin-001","sequence":1,"thread_id":"thread-001"}],"delivery_effects":[],"history":[{"action_id":"create_pin","actor":"Client Reviewer","event":"PIN_CREATED","pin_id":"pin-001","sequence":1,"thread_id":"thread-001"}],"revision":2},"command":{"action_id":"resolve_thread","actor":"Workspace Owner / Designer","expected_state_revision":1,"message_attempt_id":"target-resolve_thread","project_id":"project-fixture-001","thread_id":"thread-001","version_id":"version-fixture-001"},"contract_hash":"b00b45e8ca4804289f5d8af3bb55fc6569ee65771838459b8ba49583df349b57","deltas":{"authoritative_state":{},"business_side_effects":[],"delivery_effects":[],"history":[],"revision":0},"frozen_source":{"commit":"bbbbbbbbbbbbbbbbbbbbbbbbbbbbbbbbbbbbbbbb","tree":"cccccccccccccccccccccccccccccccccccccccc"},"product_slug":"client-feedback-portal-dogfood-v2","protocol_version":"joewrks.downstream.execution/1.0","record_kind":"execution_evidence","result":{"latest_state_revision":2,"latest_version":{"revision":2,"status":"DRAFT","version_id":"version-fixture-001"},"result_class":"STALE"},"sequence_id":"M6-TEST-060173c855c9928b27eb5912","test_id":"TEST-060173c855c9928b27eb5912"},{"adapter":{"name":"m6-dogfood-local-fixture","version":"1.0.0"},"after":{"authoritative_state":{"active_review_link_id":null,"pins":[],"project_id":"project-fixture-001","review_link_revision":2,"review_links":[{"link_id":"review-link-001","project_id":"project-fixture-001","recipient":"client-reviewer@example.test","status":"REVOKED","validity_days":30,"version_id":"version-fixture-001"}],"threads":[],"version":{"revision":3,"status":"IN_REVIEW","version_id":"version-fixture-001"}},"business_side_effects":[{"action_id":"send_review_request","effect":"REVIEW_LINK_CREATED","link_id":"review-link-001","sequence":1},{"action_id":"revoke_review_link","effect":"REVIEW_LINK_REVOKED","link_id":"review-link-001","sequence":2}],"delivery_effects":[{"action_id":"send_review_request","effect":"REVIEW_EMAIL_SENT","link_id":"review-link-001","recipient":"client-reviewer@example.test","sequence":1}],"history":[{"action_id":"send_review_request","actor":"Workspace Owner / Designer","event":"REVIEW_REQUEST_SENT","link_id":"review-link-001","sequence":1},{"action_id":"revoke_review_link","actor":"Workspace Owner / Designer","event":"REVIEW_LINK_REVOKED","link_id":"review-link-001","sequence":2}],"revision":3},"authority":{"approved_digest":"e33deda04bae78eab0da60ba432c47a0779bce17c4bee7d1c5695455d9d9f68c","approved_revision":1},"before":{"authoritative_state":{"active_review_link_id":null,"pins":[],"project_id":"project-fixture-001","review_link_revision":2,"review_links":[{"link_id":"review-link-001","project_id":"project-fixture-001","recipient":"client-reviewer@example.test","status":"REVOKED","validity_days":30,"version_id":"version-fixture-001"}],"threads":[],"version":{"revision":3,"status":"IN_REVIEW","version_id":"version-fixture-001"}},"business_side_effects":[{"action_id":"send_review_request","effect":"REVIEW_LINK_CREATED","link_id":"review-link-001","sequence":1},{"action_id":"revoke_review_link","effect":"REVIEW_LINK_REVOKED","link_id":"review-link-001","sequence":2}],"delivery_effects":[{"action_id":"send_review_request","effect":"REVIEW_EMAIL_SENT","link_id":"review-link-001","recipient":"client-reviewer@example.test","sequence":1}],"history":[{"action_id":"send_review_request","actor":"Workspace Owner / Designer","event":"REVIEW_REQUEST_SENT","link_id":"review-link-001","sequence":1},{"action_id":"revoke_review_link","actor":"Workspace Owner / Designer","event":"REVIEW_LINK_REVOKED","link_id":"review-link-001","sequence":2}],"revision":3},"command":{"action_id":"revoke_review_link","actor":"Workspace Owner / Designer","client_attempt_id":"target-revoke_review_link","expected_review_link_revision":1,"project_id":"project-fixture-001","recipient":"client-reviewer@example.test","version_id":"version-fixture-001"},"contract_hash":"b00b45e8ca4804289f5d8af3bb55fc6569ee65771838459b8ba49583df349b57","deltas":{"authoritative_state":{},"business_side_effects":[],"delivery_effects":[],"history":[],"revision":0},"frozen_source":{"commit":"bbbbbbbbbbbbbbbbbbbbbbbbbbbbbbbbbbbbbbbb","tree":"cccccccccccccccccccccccccccccccccccccccc"},"product_slug":"client-feedback-portal-dogfood-v2","protocol_version":"joewrks.downstream.execution/1.0","record_kind":"execution_evidence","result":{"committed_result":{"notification_sent":false,"result_class":"SUCCESS","review_link_revision":2,"revoked_review_link":{"link_id":"review-link-001","project_id":"project-fixture-001","recipient":"client-reviewer@example.test","status":"REVOKED","validity_days":30,"version_id":"version-fixture-001"}},"result_class":"IDEMPOTENT_REPLAY"},"sequence_id":"M6-TEST-1d9b4a2e5968c0246542bb37","test_id":"TEST-1d9b4a2e5968c0246542bb37"},{"adapter":{"name":"m6-dogfood-local-fixture","version":"1.0.0"},"after":{"authoritative_state":{"active_review_link_id":null,"pins":[],"project_id":"project-fixture-001","review_link_revision":0,"review_links":[],"threads":[],"version":{"revision":1,"status":"DRAFT","version_id":"version-fixture-001"}},"business_side_effects":[],"delivery_effects":[],"history":[],"revision":1},"authority":{"approved_digest":"e33deda04bae78eab0da60ba432c47a0779bce17c4bee7d1c5695455d9d9f68c","approved_revision":1},"before":{"authoritative_state":{"active_review_link_id":null,"pins":[],"project_id":"project-fixture-001","review_link_revision":0,"review_links":[],"threads":[],"version":{"revision":1,"status":"DRAFT","version_id":"version-fixture-001"}},"business_side_effects":[],"delivery_effects":[],"history":[],"revision":1},"command":{"action_id":"create_pin","actor":"UNAUTHORIZED_FIXTURE_ACTOR","comment":"Fixture root comment.","expected_state_revision":1,"media_type":"IMAGE","message_attempt_id":"target-create_pin","project_id":"project-fixture-001","version_id":"version-fixture-001","x":0.25,"y":0.75},"contract_hash":"b00b45e8ca4804289f5d8af3bb55fc6569ee65771838459b8ba49583df349b57","deltas":{"authoritative_state":{},"business_side_effects":[],"delivery_effects":[],"history":[],"revision":0},"frozen_source":{"commit":"bbbbbbbbbbbbbbbbbbbbbbbbbbbbbbbbbbbbbbbb","tree":"cccccccccccccccccccccccccccccccccccccccc"},"product_slug":"client-feedback-portal-dogfood-v2","protocol_version":"joewrks.downstream.execution/1.0","record_kind":"execution_evidence","result":{"error":{"code":"ACTOR_NOT_ALLOWED"},"result_class":"REJECTED"},"sequence_id":"M6-TEST-20bef088ebc99c0feea3f468","test_id":"TEST-20bef088ebc99c0feea3f468"},{"adapter":{"name":"m6-dogfood-local-fixture","version":"1.0.0"},"after":{"authoritative_state":{"active_review_link_id":"review-link-001","pins":[],"project_id":"project-fixture-001","review_link_revision":1,"review_links":[{"link_id":"review-link-001","project_id":"project-fixture-001","recipient":"client-reviewer@example.test","status":"ACTIVE","validity_days":30,"version_id":"version-fixture-001"}],"threads":[],"version":{"revision":2,"status":"IN_REVIEW","version_id":"version-fixture-001"}},"business_side_effects":[{"action_id":"send_review_request","effect":"REVIEW_LINK_CREATED","link_id":"review-link-001","sequence":1}],"delivery_effects":[{"action_id":"send_review_request","effect":"REVIEW_EMAIL_SENT","link_id":"review-link-001","recipient":"client-reviewer@example.test","sequence":1}],"history":[{"action_id":"send_review_request","actor":"Workspace Owner / Designer","event":"REVIEW_REQUEST_SENT","link_id":"review-link-001","sequence":1}],"revision":2},"authority":{"approved_digest":"e33deda04bae78eab0da60ba432c47a0779bce17c4bee7d1c5695455d9d9f68c","approved_revision":1},"before":{"authoritative_state":{"active_review_link_id":"review-link-001","pins":[],"project_id":"project-fixture-001","review_link_revision":1,"review_links":[{"link_id":"review-link-001","project_id":"project-fixture-001","recipient":"client-reviewer@example.test","status":"ACTIVE","validity_days":30,"version_id":"version-fixture-001"}],"threads":[],"version":{"revision":2,"status":"IN_REVIEW","version_id":"version-fixture-001"}},"business_side_effects":[{"action_id":"send_review_request","effect":"REVIEW_LINK_CREATED","link_id":"review-link-001","sequence":1}],"delivery_effects":[{"action_i